{
  "$schema": "https://json-schema.org/draft/2020-12/schema",
  "$id": "https://example.com/schemas/dcc-record.schema.json",
  "title": "Dungeon Crawler Carl Record",
  "type": "object",
  "additionalProperties": false,
  "required": [
    "id",
    "name",
    "kind",
    "effects",
    "provenance",
    "metadata"
  ],
  "properties": {
    "id": { "type": "string" },
    "name": { "type": "string" },
    "aliases": { "type": "array", "items": { "type": "string" } },
    "series": { "type": "string", "default": "Dungeon Crawler Carl" },
    "kind": {
      "type": "string",
      "enum": [
        "Item",
        "Consumable",
        "Weapon",
        "Projectile",
        "Vehicle",
        "Interface",
        "Mechanic",
        "Tool",
        "LootBox",
        "CraftingStation",
        "Card",
        "Apparel",
        "Accessory",
        "Shield",
        "Armor",
        "Ability",
        "Perk",
        "Title",
        "Tattoo",
        "Character",
        "Other"
      ]
    },
    "kind_detail": { "type": ["array", "null"], "items": { "type": "string" } },
    "subcategory": { "type": ["string", "null"] },
    "slot": { "type": ["string", "null"] },
    "rarity": { "type": ["string", "null"] },
    "level_requirement": { "type": ["integer", "null"] },
    "tags": { "type": "array", "items": { "type": "string" } },
    "description": { "type": ["string", "null"] },
    "ai_description": { "type": ["string", "null"] },
    "form": {
      "type": ["object", "null"],
      "additionalProperties": false,
      "properties": {
        "conjured": { "type": "boolean" },
        "material": { "type": ["string", "null"] },
        "description": { "type": ["string", "null"] }
      }
    },
    "activation": {
      "type": "array",
      "items": {
        "type": "object",
        "additionalProperties": false,
        "properties": {
          "via": {
            "type": "string",
            "description": "command|gesture|ui|passive|throw|drink|equip"
          },
          "detail": { "type": ["string", "null"] },
          "cooldown_seconds": { "type": ["number", "null"] },
          "charges": { "type": ["integer", "null"] }
        }
      }
    },
    "enchantments": {
      "type": "array",
      "items": {
        "type": "object",
        "additionalProperties": true,
        "properties": {
          "name": { "type": "string" },
          "parameters": { "type": "object" }
        }
      }
    },
    "images": {
      "type": "array",
      "items": {
        "type": "object",
        "required": ["type", "src"],
        "additionalProperties": false,
        "properties": {
          "type": {
            "type": "string",
            "enum": ["icon", "portrait", "token", "tile", "splash", "other"]
          },
          "src": { "type": "string" },
          "srcset": {
            "type": "array",
            "items": {
              "type": "object",
              "required": ["src"],
              "properties": {
                "src": { "type": "string" },
                "descriptor": { "type": ["string", "null"] }
              },
              "additionalProperties": false
            }
          },
          "alt": { "type": ["string", "null"] },
          "title": { "type": ["string", "null"] },
          "width": { "type": ["integer", "null"] },
          "height": { "type": ["integer", "null"] },
          "mime": { "type": ["string", "null"] },
          "transparent": { "type": ["boolean", "null"] },
          "focal_point": {
            "type": ["object", "null"],
            "properties": {
              "x": { "type": "number" },
              "y": { "type": "number" }
            },
            "additionalProperties": false
          },
          "attribution": {
            "type": ["object", "null"],
            "properties": {
              "author": { "type": ["string", "null"] },
              "source_url": { "type": ["string", "null"] },
              "license": { "type": ["string", "null"] }
            },
            "additionalProperties": false
          },
          "hash_sha256": { "type": ["string", "null"] },
          "cdn_key": { "type": ["string", "null"] },
          "spoiler": { "type": ["boolean", "null"] },
          "foundry": {
            "type": ["object", "null"],
            "properties": {
              "token_border": { "type": ["boolean", "null"] },
              "ring_color": { "type": ["string", "null"] },
              "size_grid": { "type": ["number", "null"] }
            },
            "additionalProperties": false
          }
        }
      }
    },
    "weapon": {
      "type": ["object", "null"],
      "additionalProperties": false,
      "properties": {
        "category": { "type": "string" },
        "handedness": { "type": ["string", "null"] },
        "reach_m": { "type": ["number", "null"] },
        "range_m": {
          "type": ["object", "null"],
          "properties": {
            "normal": { "type": "number" },
            "long": { "type": "number" }
          },
          "additionalProperties": false
        },
        "properties": { "type": "array", "items": { "type": "string" } },
        "damage": {
          "type": "array",
          "items": {
            "type": "object",
            "properties": {
              "dice": { "type": "string" },
              "type": { "type": "string" },
              "on_crit": { "type": ["string", "null"] }
            },
            "additionalProperties": false
          }
        }
      }
    },
    "consumable": {
      "type": ["object", "null"],
      "additionalProperties": false,
      "properties": {
        "uses": { "type": ["integer", "null"] },
        "stack_limit": { "type": ["integer", "null"] },
        "use_time": { "type": ["string", "null"] },
        "cooldown_seconds": { "type": ["number", "null"] },
        "duration_seconds": { "type": ["number", "null"] },
        "overdose_rules": { "type": ["string", "null"] }
      }
    },
    "power": {
      "type": ["object", "null"],
      "additionalProperties": false,
      "properties": {
        "charges_max": { "type": ["integer", "null"] },
        "charges_current": { "type": ["integer", "null"] },
        "recharge": {
          "type": ["object", "null"],
          "properties": {
            "method": { "type": "string" },
            "rate_per_hour": { "type": ["number", "null"] }
          },
          "additionalProperties": false
        },
        "energy_type": { "type": ["string", "null"] }
      }
    },
    "effects": {
      "type": "array",
      "items": {
        "type": "object",
        "required": ["name", "trigger"],
        "additionalProperties": false,
        "properties": {
          "name": { "type": "string" },
          "trigger": {
            "type": "object",
            "properties": {
              "event": { "type": "string" },
              "conditions": {
                "type": "array",
                "items": {
                  "type": "object",
                  "properties": {
                    "left": { "type": "string" },
                    "op": { "type": "string" },
                    "right": {}
                  },
                  "additionalProperties": false
                }
              }
            },
            "additionalProperties": false
          },
          "chance": { "type": ["number", "null"], "minimum": 0, "maximum": 1 },
          "area": {
            "type": ["object", "null"],
            "properties": {
              "shape": {
                "type": "string",
                "enum": ["sphere", "cube", "cone", "line", "cylinder"]
              },
              "size": { "type": "number" },
              "origin": { "type": "string" }
            },
            "additionalProperties": false
          },
          "save": {
            "type": ["object", "null"],
            "properties": {
              "ability": { "type": "string" },
              "dc": { "type": "number" },
              "on_success": { "type": "string" }
            },
            "additionalProperties": false
          },
          "modifiers": {
            "type": "array",
            "items": {
              "type": "object",
              "properties": {
                "stat": { "type": "string" },
                "op": { "type": "string", "enum": ["add", "mul", "set"] },
                "value": {},
                "stack_rule": { "type": ["string", "null"] }
              },
              "additionalProperties": false
            }
          },
          "targeting": {
            "type": ["object", "null"],
            "properties": {
              "requires_los": { "type": "boolean" },
              "max_targets": { "type": ["integer", "null"] },
              "target_filter": { "type": ["string", "null"] }
            },
            "additionalProperties": false
          },
          "outcomes": {
            "type": "array",
            "items": {
              "type": "object",
              "required": ["result"],
              "properties": {
                "weight": { "type": ["number", "null"] },
                "prob": {
                  "type": ["number", "null"],
                  "minimum": 0,
                  "maximum": 1
                },
                "result": { "type": "string" },
                "effects": {
                  "type": "array",
                  "items": {
                    "type": "object",
                    "properties": {
                      "action": { "type": "string" },
                      "targets": {
                        "type": "array",
                        "items": { "type": "string" }
                      },
                      "params": { "type": "object" }
                    },
                    "additionalProperties": false
                  }
                }
              },
              "additionalProperties": false
            }
          },
          "notes": { "type": ["string", "null"] }
        }
      }
    },
    "attunement": {
      "type": ["object", "null"],
      "properties": {
        "required": { "type": "boolean" },
        "slots": { "type": ["integer", "null"] },
        "bound_to_character": { "type": ["boolean", "null"] },
        "removal_conditions": { "type": ["string", "null"] }
      },
      "additionalProperties": false
    },
    "tattoo": {
      "type": ["object", "null"],
      "properties": {
        "body_location": { "type": "string" },
        "faction_keys": { "type": "array", "items": { "type": "string" } }
      },
      "additionalProperties": false
    },
    "tech": {
      "type": ["object", "null"],
      "properties": {
        "manufacturer": { "type": ["string", "null"] },
        "model": { "type": ["string", "null"] },
        "firmware": { "type": ["string", "null"] },
        "compatibility": { "type": "array", "items": { "type": "string" } }
      },
      "additionalProperties": false
    },
    "physical": {
      "type": ["object", "null"],
      "properties": {
        "weight_kg": { "type": ["number", "null"] },
        "size_category": { "type": ["string", "null"] },
        "dimensions_cm": {
          "type": ["object", "null"],
          "properties": {
            "w": { "type": "number" },
            "h": { "type": "number" },
            "d": { "type": "number" }
          },
          "additionalProperties": false
        },
        "durability": {
          "type": ["object", "null"],
          "properties": {
            "max": { "type": "integer" },
            "current": { "type": "integer" },
            "on_break": { "type": "string" }
          },
          "additionalProperties": false
        }
      },
      "additionalProperties": false
    },
    "economy": {
      "type": ["object", "null"],
      "properties": {
        "cost": { "type": ["number", "null"] },
        "currency": { "type": ["string", "null"] },
        "trade_value": { "type": ["number", "null"] }
      },
      "additionalProperties": false
    },
    "rules_text": { "type": ["string", "null"] },
    "dnd5e_mapping": {
      "type": ["object", "null"],
      "properties": {
        "ac_bonus": { "type": ["integer", "null"] },
        "requires_attunement": { "type": ["boolean", "null"] },
        "action_economy": { "type": ["string", "null"] },
        "notes": { "type": ["string", "null"] }
      },
      "additionalProperties": false
    },
    "balance_flags": {
      "type": ["object", "null"],
      "properties": {
        "gm_review_required": { "type": ["boolean", "null"] },
        "homebrew_adjustments": { "type": ["string", "null"] }
      },
      "additionalProperties": false
    },
    "provenance": {
      "type": "object",
      "required": [
        "source_type",
        "source_ref",
        "extraction_method",
        "confidence"
      ],
      "properties": {
        "source_type": { "type": "string" },
        "source_ref": { "type": "string" },
        "extraction_method": { "type": "string" },
        "extraction_notes": { "type": ["string", "null"] },
        "confidence": { "type": "number", "minimum": 0, "maximum": 1 }
      },
      "additionalProperties": false
    },
    "metadata": {
      "type": "object",
      "required": ["created_at", "updated_at", "version", "license"],
      "properties": {
        "created_at": { "type": "string", "format": "date-time" },
        "updated_at": { "type": "string", "format": "date-time" },
        "version": { "type": "string" },
        "license": { "type": "string" }
      },
      "additionalProperties": false
    }
  }
}
