{
  "activation": [],
  "ai_description": null,
  "aliases": [],
  "attunement": null,
  "balance_flags": null,
  "consumable": null,
  "description": "The Skydiver's Box is a Loot Box distributed the Cannonball! Achievement for falling from a great height.",
  "dnd5e_mapping": null,
  "economy": null,
  "effects": [],
  "enchantments": [],
  "form": null,
  "id": "skydiver-s-box",
  "images": [],
  "kind": "LootBox",
  "kind_detail": [
    "Loot Boxes"
  ],
  "level_requirement": null,
  "metadata": {
    "created_at": "2023-10-01T00:00:00Z",
    "license": "TBD",
    "updated_at": "2023-10-01T00:00:00Z",
    "version": "1.0.0"
  },
  "name": "Skydiver's Box",
  "physical": null,
  "power": null,
  "provenance": {
    "confidence": 0.7,
    "extraction_method": "llm",
    "extraction_notes": null,
    "source_ref": "https://dungeon-crawler-carl.fandom.com/wiki/Skydiver's_Box",
    "source_type": "wiki"
  },
  "rarity": null,
  "rules_text": null,
  "series": "Dungeon Crawler Carl",
  "slot": null,
  "subcategory": null,
  "tags": [],
  "tattoo": null,
  "tech": null,
  "weapon": null
}