{
  "activation": [],
  "ai_description": null,
  "aliases": [],
  "attunement": null,
  "balance_flags": null,
  "consumable": null,
  "description": "Legendary loot box awarded as a result of actions visible to everyone.",
  "dnd5e_mapping": null,
  "economy": null,
  "effects": [],
  "enchantments": [],
  "form": null,
  "id": "you-know-everybody-can-see-you-right-box",
  "images": [
    {
      "alt": null,
      "attribution": null,
      "cdn_key": null,
      "focal_point": null,
      "foundry": null,
      "hash_sha256": null,
      "height": null,
      "mime": null,
      "spoiler": null,
      "src": "https://static.wikia.nocookie.net/dungeon-crawler-carl/images/6/62/You_know_everyone_can_see_you.jpg/revision/latest?cb=20250309055255",
      "srcset": [],
      "title": null,
      "transparent": null,
      "type": "icon",
      "width": null
    }
  ],
  "kind": "LootBox",
  "kind_detail": [
    "Loot Boxes"
  ],
  "level_requirement": null,
  "metadata": {
    "created_at": "2023-10-01T00:00:00Z",
    "license": "TBD",
    "updated_at": "2023-10-01T00:00:00Z",
    "version": "1.0.0"
  },
  "name": "You Know Everybody Can See You Right? Box",
  "physical": null,
  "power": null,
  "provenance": {
    "confidence": 0.7,
    "extraction_method": "llm",
    "extraction_notes": null,
    "source_ref": "https://dungeon-crawler-carl.fandom.com/wiki/You_Know_Everybody_Can_See_You_Right?_Box",
    "source_type": "wiki"
  },
  "rarity": null,
  "rules_text": "Item awarded for being visible while performing actions.",
  "series": "Dungeon Crawler Carl",
  "slot": null,
  "subcategory": null,
  "tags": [],
  "tattoo": null,
  "tech": null,
  "weapon": null
}
