{
  "activation": [],
  "ai_description": null,
  "aliases": [],
  "attunement": null,
  "balance_flags": null,
  "consumable": null,
  "description": "An Automaton Table is a crafting table where crawlers can create automaton robots.",
  "dnd5e_mapping": null,
  "economy": null,
  "effects": [
    {
      "area": null,
      "chance": null,
      "modifiers": [],
      "name": "Work on Automaton Robots",
      "notes": null,
      "outcomes": [],
      "save": null,
      "targeting": null,
      "trigger": {
        "conditions": [],
        "event": "unspecified"
      }
    }
  ],
  "enchantments": [],
  "form": null,
  "id": "automaton-table",
  "images": [
    {
      "alt": null,
      "attribution": null,
      "cdn_key": null,
      "focal_point": null,
      "foundry": null,
      "hash_sha256": null,
      "height": null,
      "mime": null,
      "spoiler": null,
      "src": "https://static.wikia.nocookie.net/dungeon-crawler-carl/images/5/5e/Automaton_Table.jpg/revision/latest?cb=20240830210146",
      "srcset": [],
      "title": null,
      "transparent": null,
      "type": "other",
      "width": null
    }
  ],
  "kind": "CraftingStation",
  "kind_detail": [
    "Crafting Table"
  ],
  "level_requirement": null,
  "metadata": {
    "created_at": "2023-10-01T00:00:00Z",
    "license": "TBD",
    "updated_at": "2023-10-01T00:00:00Z",
    "version": "1.0.0"
  },
  "name": "Automaton Table",
  "physical": null,
  "power": null,
  "provenance": {
    "confidence": 0.7,
    "extraction_method": "llm",
    "extraction_notes": null,
    "source_ref": "https://dungeon-crawler-carl.fandom.com/wiki/Automaton_Table",
    "source_type": "wiki"
  },
  "rarity": null,
  "rules_text": "Crafting table for creating automaton robots.",
  "series": "Dungeon Crawler Carl",
  "slot": null,
  "subcategory": null,
  "tags": [
    "Crafting Tables",
    "Crafting",
    "Items"
  ],
  "tattoo": null,
  "tech": null,
  "weapon": null
}
