{
  "activation": [],
  "ai_description": "This kit contains 12 essential items for proper foot care. The magical enhancements of this item may only be imbued within a Safe or Personal Space. Warning: All of these enhancements require you to remain barefoot.",
  "aliases": [],
  "attunement": null,
  "balance_flags": null,
  "consumable": null,
  "description": "The Enchanted Pedicure Kit of the Sylph is a black, zippered folder containing (12) metal pedicure tools that provides multiple buffs for foot care.",
  "dnd5e_mapping": null,
  "economy": null,
  "effects": [
    {
      "area": null,
      "chance": null,
      "modifiers": [
        {
          "op": "add",
          "stack_rule": null,
          "stat": "damage",
          "value": 15
        }
      ],
      "name": "Damage Buff",
      "outcomes": [],
      "save": null,
      "targeting": null,
      "trigger": {
        "conditions": [],
        "event": "Use Item"
      }
    },
    {
      "area": null,
      "chance": null,
      "modifiers": [
        {
          "op": "add",
          "stack_rule": null,
          "stat": "Smush Skill",
          "value": 3
        }
      ],
      "name": "Smush Skill Buff",
      "outcomes": [],
      "save": null,
      "targeting": null,
      "trigger": {
        "conditions": [],
        "event": "Use Item"
      }
    },
    {
      "area": null,
      "chance": null,
      "modifiers": [],
      "name": "Unbreakable Buff",
      "outcomes": [],
      "save": null,
      "targeting": null,
      "trigger": {
        "conditions": [],
        "event": "Use Item"
      }
    },
    {
      "area": null,
      "chance": null,
      "modifiers": [],
      "name": "Celestially Nimble and Tidy Buff",
      "outcomes": [],
      "save": null,
      "targeting": null,
      "trigger": {
        "conditions": [],
        "event": "Use Item"
      }
    }
  ],
  "enchantments": [],
  "form": null,
  "id": "enchanted-pedicure-kit-of-the-sylph",
  "images": [
    {
      "alt": "Enchanted Pedicure Kit of the Sylph",
      "attribution": null,
      "cdn_key": null,
      "focal_point": null,
      "foundry": null,
      "hash_sha256": null,
      "height": null,
      "mime": null,
      "spoiler": null,
      "src": "https://static.wikia.nocookie.net/dungeon-crawler-carl/images/d/dd/Pedicure_Kit.png/revision/latest?cb=20250530034240",
      "srcset": [],
      "title": null,
      "transparent": null,
      "type": "icon",
      "width": null
    }
  ],
  "kind": "Other",
  "kind_detail": [
    "Daily Buff: 30 Hours",
    "Feet Only."
  ],
  "level_requirement": null,
  "metadata": {
    "created_at": "2023-10-01T00:00:00Z",
    "license": "TBD",
    "updated_at": "2023-10-01T00:00:00Z",
    "version": "1.0.0"
  },
  "name": "Enchanted Pedicure Kit of the Sylph",
  "physical": null,
  "power": null,
  "provenance": {
    "confidence": 0.7,
    "extraction_method": "llm",
    "extraction_notes": null,
    "source_ref": "https://dungeon-crawler-carl.fandom.com/wiki/Enchanted_Pedicure_Kit_of_the_Sylph",
    "source_type": "wiki"
  },
  "rarity": null,
  "rules_text": "Provides buffs for proper foot care and requires bare feet.",
  "series": "Dungeon Crawler Carl",
  "slot": null,
  "subcategory": null,
  "tags": [],
  "tattoo": null,
  "tech": null,
  "weapon": null
}
