{
  "activation": [],
  "ai_description": "--> is a mushroom that, upon touching the top, extrudes a spike and causes skin to boil if it pierces you, The spike only activates if you touch the top, therefore it is advised that you should only touch the stem of this mushroom. The has useful alchemical properties.",
  "aliases": [],
  "attunement": null,
  "balance_flags": null,
  "consumable": null,
  "description": "A mushroom that, upon touching the top, extrudes a spike and causes skin to boil if it pierces you. The spike only activates if you touch the top, therefore it is advised that you should only touch the stem of this mushroom. The Skewer Belle has useful alchemical properties.",
  "dnd5e_mapping": null,
  "economy": null,
  "effects": [],
  "enchantments": [],
  "form": null,
  "id": "skewer-belle",
  "images": [],
  "kind": "Item",
  "kind_detail": [
    "Crafting Material"
  ],
  "level_requirement": null,
  "metadata": {
    "created_at": "2023-10-01T00:00:00Z",
    "license": "TBD",
    "updated_at": "2023-10-01T00:00:00Z",
    "version": "1.0.0"
  },
  "name": "Skewer Belle",
  "physical": null,
  "power": null,
  "provenance": {
    "confidence": 0.7,
    "extraction_method": "llm",
    "extraction_notes": null,
    "source_ref": "https://dungeon-crawler-carl.fandom.com/wiki/Skewer_Belle",
    "source_type": "wiki"
  },
  "rarity": null,
  "rules_text": "Useful Alchemical properties",
  "series": "Dungeon Crawler Carl",
  "slot": null,
  "subcategory": "Crafting Material",
  "tags": [],
  "tattoo": null,
  "tech": null,
  "weapon": null
}