{
  "activation": [],
  "ai_description": "Soul Crystal. C-Grade. Elf technology. Itâ€™s like a wireless charger. Instead of electricity, it runs on the soul power of everything killed within the area. If this crystal is physically touched by living flesh, it will shatter and cease to work.",
  "aliases": [],
  "attunement": null,
  "balance_flags": null,
  "consumable": null,
  "description": "Soul crystals are known as being less efficient and less stable than Dwarven Batteries.",
  "dnd5e_mapping": null,
  "economy": null,
  "effects": [],
  "enchantments": [],
  "form": null,
  "id": "soul-crystal-or-soul-gem",
  "images": [],
  "kind": "Other",
  "kind_detail": [
    "|keywords= Elf"
  ],
  "level_requirement": null,
  "metadata": {
    "created_at": "2023-10-01T00:00:00Z",
    "license": "TBD",
    "updated_at": "2023-10-01T00:00:00Z",
    "version": "1.0.0"
  },
  "name": "Soul Crystal or Soul Gem",
  "physical": null,
  "power": null,
  "provenance": {
    "confidence": 0.7,
    "extraction_method": "llm",
    "extraction_notes": null,
    "source_ref": "https://dungeon-crawler-carl.fandom.com/wiki/Soul_Crystals",
    "source_type": "wiki"
  },
  "rarity": null,
  "rules_text": "Powers various Magic & Spells.",
  "series": "Dungeon Crawler Carl",
  "slot": null,
  "subcategory": null,
  "tags": [
    "Elf",
    "Magic & Spells"
  ],
  "tattoo": null,
  "tech": null,
  "weapon": null
}