{
  "activation": [],
  "ai_description": null,
  "aliases": [],
  "attunement": null,
  "balance_flags": null,
  "consumable": null,
  "description": "Spider Stalkers are a robotic version of a common mob named Rot Stickers.",
  "dnd5e_mapping": null,
  "economy": null,
  "effects": [],
  "enchantments": [],
  "form": null,
  "id": "spider-stalker",
  "images": [],
  "kind": "Item",
  "kind_detail": [],
  "level_requirement": null,
  "metadata": {
    "created_at": "2023-10-01T00:00:00Z",
    "license": "TBD",
    "updated_at": "2023-10-01T00:00:00Z",
    "version": "1.0.0"
  },
  "name": "Spider Stalker",
  "physical": null,
  "power": null,
  "provenance": {
    "confidence": 0.7,
    "extraction_method": "llm",
    "extraction_notes": null,
    "source_ref": "https://dungeon-crawler-carl.fandom.com/wiki/Spider_Stalker",
    "source_type": "wiki"
  },
  "rarity": null,
  "rules_text": "Robotic version of Rot Stickers.",
  "series": "Dungeon Crawler Carl",
  "slot": null,
  "subcategory": null,
  "tags": [],
  "tattoo": null,
  "tech": null,
  "weapon": null
}