{
  "activation": [],
  "ai_description": null,
  "aliases": [],
  "attunement": null,
  "balance_flags": null,
  "consumable": null,
  "description": "Brawler's Boxes are a Loot Box awarded for brawling.",
  "dnd5e_mapping": null,
  "economy": null,
  "effects": [],
  "enchantments": [],
  "form": null,
  "id": "brawlers-box",
  "images": [
    {
      "alt": "Brawler's Box",
      "attribution": null,
      "cdn_key": null,
      "focal_point": null,
      "foundry": null,
      "hash_sha256": null,
      "height": null,
      "mime": null,
      "spoiler": null,
      "src": "https://static.wikia.nocookie.net/dungeon-crawler-carl/images/4/40/00144.jpg/revision/latest?cb=20231117155256",
      "srcset": [],
      "title": null,
      "transparent": null,
      "type": "other",
      "width": null
    }
  ],
  "kind": "LootBox",
  "kind_detail": [
    "Loot Boxes"
  ],
  "level_requirement": null,
  "metadata": {
    "created_at": "2023-10-01T00:00:00Z",
    "license": "TBD",
    "updated_at": "2023-10-01T00:00:00Z",
    "version": "1.0.0"
  },
  "name": "Brawler's Box",
  "physical": null,
  "power": null,
  "provenance": {
    "confidence": 0.7,
    "extraction_method": "llm",
    "extraction_notes": null,
    "source_ref": "https://dungeon-crawler-carl.fandom.com/wiki/Brawler's_Box",
    "source_type": "wiki"
  },
  "rarity": null,
  "rules_text": "Awarded for the Two Chicks at the Same Time Achievement.",
  "series": "Dungeon Crawler Carl",
  "slot": null,
  "subcategory": null,
  "tags": [],
  "tattoo": null,
  "tech": null,
  "weapon": null
}
