{
  "activation": [],
  "ai_description": "Just Wait Until Your Daddy Gets Home – Wheeled Bomb. Type: High Yield Thermobaric Explosive. Also imbues Fear within blast radius. Effect: I hope you’re paid up on your homeowner’s insurance. Status: 250. Fortified. Boom.",
  "aliases": [],
  "attunement": null,
  "balance_flags": null,
  "consumable": null,
  "description": "High Yield Thermobaric Explosive. Also imbues Fear within blast radius.",
  "dnd5e_mapping": null,
  "economy": null,
  "effects": [],
  "enchantments": [],
  "form": null,
  "id": "just-wait-until-your-daddy-gets-home",
  "images": [],
  "kind": "Item",
  "kind_detail": [
    "|keywords="
  ],
  "level_requirement": null,
  "metadata": {
    "created_at": "2023-10-01T00:00:00Z",
    "license": "TBD",
    "updated_at": "2023-10-01T00:00:00Z",
    "version": "1.0.0"
  },
  "name": "Just Wait Until Your Daddy Gets Home",
  "physical": null,
  "power": null,
  "provenance": {
    "confidence": 0.7,
    "extraction_method": "llm",
    "extraction_notes": null,
    "source_ref": "https://dungeon-crawler-carl.fandom.com/wiki/Just_Wait_Until_Your_Daddy_Gets_Home",
    "source_type": "wiki"
  },
  "rarity": null,
  "rules_text": null,
  "series": "Dungeon Crawler Carl",
  "slot": null,
  "subcategory": null,
  "tags": [
    "Explosives"
  ],
  "tattoo": null,
  "tech": null,
  "weapon": null
}