{
  "activation": [],
  "ai_description": null,
  "aliases": [],
  "attunement": null,
  "balance_flags": null,
  "consumable": null,
  "description": "Forms a metallic buckler on command. May be triggered via hotlist or by shaking your wrist like youâ€™re thinking of your hot Aunt Lydia. This item is enchanted with Shatter.",
  "dnd5e_mapping": null,
  "economy": null,
  "effects": [
    {
      "area": null,
      "chance": 0.015,
      "modifiers": [],
      "name": "Disarm",
      "notes": null,
      "outcomes": [
        {
          "effects": [],
          "prob": null,
          "result": "Item drops to the ground",
          "weight": 0.9
        },
        {
          "effects": [],
          "prob": null,
          "result": "Weapon breaks",
          "weight": 0.05
        },
        {
          "effects": [],
          "prob": null,
          "result": "Weapon transferred to inventory",
          "weight": 0.05
        }
      ],
      "save": null,
      "targeting": null,
      "trigger": {
        "conditions": [],
        "event": "on_hit"
      }
    }
  ],
  "enchantments": [
    {
      "name": "Shatter Spell",
      "parameters": {}
    }
  ],
  "form": null,
  "id": "enchanted-auto-buckler-of-the-peach-pit",
  "images": [
    {
      "alt": "Enchanted Auto Buckler of the Peach Pit",
      "attribution": null,
      "cdn_key": null,
      "focal_point": null,
      "foundry": null,
      "hash_sha256": null,
      "height": null,
      "mime": null,
      "spoiler": null,
      "src": "https://static.wikia.nocookie.net/dungeon-crawler-carl/images/9/93/00516.jpg/revision/latest?cb=20231205231331",
      "srcset": [],
      "title": null,
      "transparent": null,
      "type": "icon",
      "width": null
    }
  ],
  "kind": "Shield",
  "kind_detail": [
    "Shield"
  ],
  "level_requirement": null,
  "metadata": {
    "created_at": "2023-10-01T00:00:00Z",
    "license": "TBD",
    "updated_at": "2023-10-01T00:00:00Z",
    "version": "1.0.0"
  },
  "name": "Enchanted Auto Buckler of the Peach Pit",
  "physical": null,
  "power": null,
  "provenance": {
    "confidence": 0.7,
    "extraction_method": "llm",
    "extraction_notes": null,
    "source_ref": "https://dungeon-crawler-carl.fandom.com/wiki/Enchanted_Auto_Buckler_of_the_Peach_Pit",
    "source_type": "wiki"
  },
  "rarity": null,
  "rules_text": "Shield with disarm chance upon attack.",
  "series": "Dungeon Crawler Carl",
  "slot": null,
  "subcategory": null,
  "tags": [],
  "tattoo": null,
  "tech": null,
  "weapon": null
}
