{
  "activation": [],
  "ai_description": null,
  "aliases": [],
  "attunement": null,
  "balance_flags": null,
  "consumable": null,
  "description": "Stairwells allow for passage between floors in the dungeon, indicated on the map as a white square.",
  "dnd5e_mapping": null,
  "economy": null,
  "effects": [
    {
      "area": null,
      "chance": null,
      "modifiers": [],
      "name": "Health refill on descent",
      "notes": null,
      "outcomes": [],
      "save": null,
      "targeting": null,
      "trigger": {
        "conditions": [],
        "event": "descent"
      }
    }
  ],
  "enchantments": [],
  "form": null,
  "id": "stairwells",
  "images": [
    {
      "alt": "Art by u/OutFold, Reddit",
      "attribution": null,
      "focal_point": null,
      "foundry": null,
      "height": null,
      "mime": null,
      "src": "https://static.wikia.nocookie.net/dungeon-crawler-carl/images/b/b1/Stairwells_by_Outfold.jpg/revision/latest?cb=20250404045412",
      "srcset": [],
      "title": "Stairwells by Outfold",
      "type": "other",
      "width": null
    },
    {
      "alt": "Official art by Erik Wilson",
      "attribution": null,
      "focal_point": null,
      "foundry": null,
      "height": null,
      "mime": null,
      "src": "https://static.wikia.nocookie.net/dungeon-crawler-carl/images/b/b1/Stairwells_by_Outfold.jpg/revision/latest?cb=20250404045412",
      "srcset": [],
      "title": "Stairwells by Erik Wilson",
      "type": "other",
      "width": null
    },
    {
      "alt": "Art by u/Mashermello, Reddit",
      "attribution": null,
      "focal_point": null,
      "foundry": null,
      "height": null,
      "mime": null,
      "src": "https://static.wikia.nocookie.net/dungeon-crawler-carl/images/b/b1/Stairwells_by_Outfold.jpg/revision/latest?cb=20250404045412",
      "srcset": [],
      "title": "Stairwell by Mashermello",
      "type": "other",
      "width": null
    }
  ],
  "kind": "Mechanic",
  "kind_detail": [
    "Dungeon Mechanic"
  ],
  "level_requirement": null,
  "metadata": {
    "created_at": "2023-10-01T00:00:00Z",
    "license": "TBD",
    "updated_at": "2023-10-01T00:00:00Z",
    "version": "1.0.0"
  },
  "name": "Stairwells",
  "physical": null,
  "power": null,
  "provenance": {
    "confidence": 0.0,
    "extraction_method": "llm",
    "extraction_notes": null,
    "source_ref": "https://dungeon-crawler-carl.fandom.com/wiki/Stairwells",
    "source_type": "wiki"
  },
  "rarity": null,
  "rules_text": "Stairwells allow for passage between floors in the dungeon.",
  "series": "Dungeon Crawler Carl",
  "slot": null,
  "subcategory": null,
  "tags": [
    "Dungeon",
    "Mechanic"
  ],
  "tattoo": null,
  "tech": null,
  "weapon": null
}
